[
  {
    "years": [
      2019,
      2023,
      2024
    ],
    "paper": "prelims-1",
    "subject": "Economy",
    "gist": "Per-capita vs national income A/R; GDP/GNP/NNP deflator",
    "keywords": [
      "National",
      "Income",
      "Accounting",
      "Per-capita"
    ],
    "subtopicId": "econ-national-income"
  },
  {
    "years": [
      2019,
      2023,
      2024
    ],
    "paper": "prelims-1",
    "subject": "Polity",
    "gist": "President=executive power of Union (Art 53); Governor discretion",
    "keywords": [
      "President",
      "Governor",
      "Executive",
      "power",
      "Union"
    ],
    "subtopicId": "pol-union-executive-legislature"
  },
  {
    "years": [
      2019,
      2023,
      2024
    ],
    "paper": "prelims-2",
    "subject": "Current Affairs",
    "gist": "Navaratnalu, YSR Rythu Bharosa, Disha SOS app",
    "keywords": [
      "Current",
      "Affairs",
      "Schemes",
      "Development",
      "Navaratnalu"
    ],
    "subtopicId": "ca-regional"
  },
  {
    "years": [
      2019,
      2023,
      2024
    ],
    "paper": "prelims-2",
    "subject": "Sci&Tech",
    "gist": "PSLV/GSLV, Aditya-L1, Chandrayaan launch vehicles",
    "keywords": [
      "Space",
      "Programme",
      "ISRO",
      "Satellite",
      "Missions"
    ],
    "subtopicId": "sci-space-defence"
  },
  {
    "years": [
      2019,
      2023,
      2024
    ],
    "paper": "prelims-1",
    "subject": "Geography",
    "gist": "Relief, rivers, soils, forest types of India",
    "keywords": [
      "Indian",
      "Physical",
      "Geography",
      "Relief",
      "rivers"
    ],
    "subtopicId": "geo-physical-india"
  },
  {
    "years": [
      2019,
      2023,
      2024
    ],
    "paper": "prelims-2",
    "subject": "Mental Ability",
    "gist": "Officer-response scenario judgement items",
    "keywords": [
      "Administrative",
      "Situational",
      "Judgement",
      "Officer-response",
      "scenario"
    ],
    "subtopicId": "ment-social-intelligence-decision"
  },
  {
    "years": [
      2019,
      2023,
      2024
    ],
    "paper": "prelims-1",
    "subject": "Geography",
    "gist": "Countries, tribes, biomes; world biomes/tribes thin, no dedicated world-geo subtopic",
    "keywords": [
      "World",
      "Regional",
      "Political",
      "Geography",
      "Countries"
    ],
    "subtopicId": "geo-social-geography"
  },
  {
    "years": [
      2019,
      2023,
      2024
    ],
    "paper": "prelims-1",
    "subject": "History",
    "gist": "Ellora temples chronology; inscriptions/authors",
    "keywords": [
      "Ancient",
      "Medieval",
      "Temples",
      "Literature",
      "Inscriptions"
    ],
    "subtopicId": "hist-art-architecture"
  },
  {
    "years": [
      2019,
      2023,
      2024
    ],
    "paper": "prelims-1",
    "subject": "Geography",
    "gist": "Winds, cyclones, jet stream, climate regions",
    "keywords": [
      "Climatology",
      "Winds",
      "cyclones",
      "stream",
      "climate"
    ],
    "subtopicId": "geo-atmosphere-climatology"
  },
  {
    "years": [
      2019,
      2023,
      2024
    ],
    "paper": "prelims-2",
    "subject": "Mental Ability",
    "gist": "Divisibility, remainders, factors",
    "keywords": [
      "Number",
      "System",
      "Theory",
      "Divisibility",
      "remainders"
    ],
    "subtopicId": "ment-number-system"
  },
  {
    "years": [
      2019,
      2023,
      2024
    ],
    "paper": "prelims-2",
    "subject": "Mental Ability",
    "gist": "Missing-term / wrong-term series",
    "keywords": [
      "Number",
      "Series",
      "Patterns",
      "Missing-term",
      "wrong-term"
    ],
    "subtopicId": "ment-number-series-coding"
  },
  {
    "years": [
      2019,
      2023,
      2024
    ],
    "paper": "prelims-1",
    "subject": "Polity",
    "gist": "Whip (not in Constitution); bill procedure; committees",
    "keywords": [
      "Parliament",
      "State",
      "Legislatures",
      "Whip"
    ],
    "subtopicId": "pol-union-executive-legislature"
  },
  {
    "years": [
      2019,
      2023,
      2024
    ],
    "paper": "prelims-1",
    "subject": "Polity",
    "gist": "Writs (habeas corpus etc.), Art 12-35",
    "keywords": [
      "Fundamental",
      "Rights",
      "Writs"
    ],
    "subtopicId": "pol-fundamental-rights"
  },
  {
    "years": [
      2019,
      2023,
      2024
    ],
    "paper": "prelims-2",
    "subject": "Sci&Tech",
    "gist": "AI, cyber security, computing basics",
    "keywords": [
      "Computing",
      "Cyber",
      "Security"
    ],
    "subtopicId": "sci-ict-egovernance-cyber"
  },
  {
    "years": [
      2019,
      2023,
      2024
    ],
    "paper": "prelims-2",
    "subject": "Polity/CA",
    "gist": "Summits, UN/QUAD/BRICS orgs",
    "keywords": [
      "International",
      "Relations",
      "Summits",
      "Organisations",
      "QUAD"
    ],
    "subtopicId": "pol-international-institutions"
  },
  {
    "years": [
      2019,
      2023,
      2024
    ],
    "paper": "prelims-2",
    "subject": "Mental Ability",
    "gist": "Ratio splits, partnership profit-share",
    "keywords": [
      "Ratio",
      "Proportion",
      "Partnership",
      "splits",
      "profit-share"
    ],
    "subtopicId": "ment-ratio-proportion-averages"
  },
  {
    "years": [
      2019,
      2023,
      2024
    ],
    "paper": "prelims-2",
    "subject": "Sci&Tech",
    "gist": "Biosphere reserves, Ramsar, protected areas",
    "keywords": [
      "Environment",
      "Biodiversity",
      "Wildlife",
      "Conservation",
      "Biosphere"
    ],
    "subtopicId": "sci-environment-biodiversity-climate"
  },
  {
    "years": [
      2019,
      2023,
      2024
    ],
    "paper": "prelims-2",
    "subject": "Mental Ability",
    "gist": "Figures, cubes, dice, figure-counting",
    "keywords": [
      "Non-Verbal",
      "Reasoning",
      "Figures",
      "cubes",
      "dice"
    ],
    "subtopicId": "ment-venn-nonverbal"
  },
  {
    "years": [
      2019,
      2023,
      2024
    ],
    "paper": "prelims-2",
    "subject": "Mental Ability",
    "gist": "Age word-problems (present/future ratio)",
    "keywords": [
      "Ages",
      "word-problems"
    ],
    "subtopicId": "ment-clocks-calendars-ages"
  },
  {
    "years": [
      2019,
      2023,
      2024
    ],
    "paper": "prelims-1",
    "subject": "History",
    "gist": "GG/Viceroys, colonial acts",
    "keywords": [
      "British",
      "Expansion",
      "Governors-General",
      "Viceroys",
      "Colonial"
    ],
    "subtopicId": "hist-modern-governors-viceroys"
  },
  {
    "years": [
      2019,
      2023,
      2024
    ],
    "paper": "prelims-1",
    "subject": "History",
    "gist": "Akbar revenue officials (Amalguzar/Qanungo); architecture",
    "keywords": [
      "Mughal",
      "Empire",
      "Akbar",
      "Administration",
      "Architecture"
    ],
    "subtopicId": "hist-medieval-mughal-empire"
  },
  {
    "years": [
      2019,
      2023,
      2024
    ],
    "paper": "prelims-2",
    "subject": "Current Affairs",
    "gist": "Central schemes in news",
    "keywords": [
      "Government",
      "Schemes",
      "National",
      "Affairs",
      "Central"
    ],
    "subtopicId": "ca-national"
  },
  {
    "years": [
      2019,
      2023,
      2024
    ],
    "paper": "prelims-2",
    "subject": "Current Affairs",
    "gist": "Awards, indices, rankings",
    "keywords": [
      "Awards",
      "Honours",
      "Rankings",
      "indices"
    ],
    "subtopicId": "ca-national"
  },
  {
    "years": [
      2019,
      2023,
      2024
    ],
    "paper": "prelims-2",
    "subject": "Mental Ability",
    "gist": "Letter/number coding",
    "keywords": [
      "Coding-Decoding",
      "Letter",
      "number",
      "coding"
    ],
    "subtopicId": "ment-number-series-coding"
  },
  {
    "years": [
      2019,
      2023,
      2024
    ],
    "paper": "prelims-1",
    "subject": "History",
    "gist": "INC sessions, Gandhi movements, INA",
    "keywords": [
      "National",
      "Movement",
      "Gandhi",
      "Revolutionaries",
      "sessions"
    ],
    "subtopicId": "hist-modern-freedom-movement"
  },
  {
    "years": [
      2019,
      2023,
      2024
    ],
    "paper": "prelims-1",
    "subject": "Geography",
    "gist": "Crop-region matching",
    "keywords": [
      "Agricultural",
      "Geography",
      "crops",
      "regions",
      "Crop-region"
    ],
    "subtopicId": "geo-economic-geography"
  },
  {
    "years": [
      2019,
      2023,
      2024
    ],
    "paper": "prelims-1",
    "subject": "AP",
    "gist": "AP districts reorganisation, e-gov stack",
    "keywords": [
      "e-Governance",
      "Socio-Economic",
      "Status",
      "Districts",
      "reorganisation"
    ],
    "subtopicId": "econ-ap-economy-bifurcation"
  },
  {
    "years": [
      2019,
      2023,
      2024
    ],
    "paper": "prelims-1",
    "subject": "Polity",
    "gist": "Amendment procedure, basic-structure doctrine",
    "keywords": [
      "Constitutional",
      "Amendments",
      "Basic",
      "Structure",
      "Amendment"
    ],
    "subtopicId": "pol-amendments-basic-structure"
  },
  {
    "years": [
      2019,
      2023,
      2024
    ],
    "paper": "prelims-2",
    "subject": "Mental Ability",
    "gist": "HCF/LCM word-problems",
    "keywords": [
      "word-problems"
    ],
    "subtopicId": "ment-powers-roots-hcf-lcm"
  },
  {
    "years": [
      2019,
      2023,
      2024
    ],
    "paper": "prelims-1",
    "subject": "Geography",
    "gist": "Mineral belts, industrial location",
    "keywords": [
      "Industrial",
      "Mineral",
      "Geography",
      "belts",
      "location"
    ],
    "subtopicId": "geo-economic-geography"
  },
  {
    "years": [
      2019,
      2023,
      2024
    ],
    "paper": "prelims-2",
    "subject": "Sci&Tech",